{
  "$schema": "https://json-schema.org/draft/2020-12/schema",
  "$id": "https://github.com/danielkurdi/openbench/schemas/index.schema.json",
  "title": "openbench index file",
  "type": "object",
  "additionalProperties": false,
  "required": [
    "index_version",
    "generated_at",
    "builder_version",
    "source",
    "license",
    "record_count",
    "entries"
  ],
  "properties": {
    "index_version": { "type": "string" },
    "generated_at": { "type": "string", "format": "date-time" },
    "builder_version": { "type": "string" },
    "source": { "type": "string" },
    "license": { "type": "string" },
    "record_count": { "type": "integer", "minimum": 0 },
    "entries": {
      "type": "object",
      "additionalProperties": {
        "oneOf": [
          { "$ref": "#/$defs/entry" },
          { "type": "array", "minItems": 2, "items": { "$ref": "#/$defs/entry" } }
        ]
      }
    }
  },
  "$defs": {
    "entry": {
      "type": "object",
      "additionalProperties": false,
      "required": [
        "normalized_citation",
        "citation",
        "case_name",
        "court_code",
        "date",
        "source_urls",
        "source",
        "source_record_ids",
        "indexed_at",
        "license"
      ],
      "properties": {
        "normalized_citation": { "type": "string", "pattern": "^\\[\\d{4}\\] [A-Z]+ \\d+$" },
        "citation": { "type": "string" },
        "case_name": { "type": "string" },
        "court": { "type": ["string", "null"] },
        "court_code": { "type": "string" },
        "jurisdiction": { "type": ["string", "null"] },
        "date": { "type": "string", "format": "date" },
        "source_urls": { "type": "array", "items": { "type": "string", "format": "uri" }, "minItems": 1 },
        "source": { "type": "string" },
        "source_record_ids": { "type": "array", "items": { "type": "string" }, "minItems": 1 },
        "indexed_at": { "type": "string", "format": "date" },
        "license": { "type": "string" }
      }
    }
  }
}
