{
  "index_version": "fixture-2026-05-01",
  "generated_at": "2026-05-01T00:00:00Z",
  "builder_version": "0.1.0",
  "source": "open-australian-legal-corpus",
  "license": "CC-BY-4.0",
  "record_count": 11,
  "entries": {
    "[1992] HCA 23": {
      "normalized_citation": "[1992] HCA 23",
      "citation": "Mabo v Queensland (No 2) [1992] HCA 23",
      "case_name": "Mabo v Queensland (No 2)",
      "court": "High Court of Australia",
      "court_code": "HCA",
      "jurisdiction": "cth",
      "date": "1992-06-03",
      "source_urls": ["https://example.org/mabo", "https://example.org/mabo-mirror"],
      "source": "open-australian-legal-corpus",
      "source_record_ids": ["hca-1992-23", "austlii-mabo"],
      "indexed_at": "2026-05-01",
      "license": "CC-BY-4.0"
    },
    "[1983] HCA 21": {
      "normalized_citation": "[1983] HCA 21",
      "citation": "Commonwealth v Tasmania [1983] HCA 21",
      "case_name": "Commonwealth v Tasmania",
      "court": "High Court of Australia",
      "court_code": "HCA",
      "jurisdiction": "cth",
      "date": "1983-07-01",
      "source_urls": ["https://example.org/tasdam"],
      "source": "open-australian-legal-corpus",
      "source_record_ids": ["hca-1983-21"],
      "indexed_at": "2026-05-01",
      "license": "CC-BY-4.0"
    },
    "[1951] HCA 5": {
      "normalized_citation": "[1951] HCA 5",
      "citation": "Australian Communist Party v Commonwealth [1951] HCA 5",
      "case_name": "Australian Communist Party v Commonwealth",
      "court": "High Court of Australia",
      "court_code": "HCA",
      "jurisdiction": "cth",
      "date": "1951-03-09",
      "source_urls": ["https://example.org/acp"],
      "source": "open-australian-legal-corpus",
      "source_record_ids": ["hca-1951-5"],
      "indexed_at": "2026-05-01",
      "license": "CC-BY-4.0"
    },
    "[1996] HCA 56": {
      "normalized_citation": "[1996] HCA 56",
      "citation": "Lange v Australian Broadcasting Corporation [1996] HCA 56",
      "case_name": "Lange v Australian Broadcasting Corporation",
      "court": "High Court of Australia",
      "court_code": "HCA",
      "jurisdiction": "cth",
      "date": "1996-12-13",
      "source_urls": ["https://example.org/lange"],
      "source": "open-australian-legal-corpus",
      "source_record_ids": ["hca-1996-56"],
      "indexed_at": "2026-05-01",
      "license": "CC-BY-4.0"
    },
    "[2013] HCA 23": {
      "normalized_citation": "[2013] HCA 23",
      "citation": "Monis v The Queen [2013] HCA 4",
      "case_name": "Monis v The Queen",
      "court": "High Court of Australia",
      "court_code": "HCA",
      "jurisdiction": "cth",
      "date": "2013-02-27",
      "source_urls": ["https://example.org/monis"],
      "source": "open-australian-legal-corpus",
      "source_record_ids": ["hca-2013-23"],
      "indexed_at": "2026-05-01",
      "license": "CC-BY-4.0"
    },
    "[2002] FCAFC 250": {
      "normalized_citation": "[2002] FCAFC 250",
      "citation": "Roadshow Films v iiNet [2002] FCAFC 250",
      "case_name": "Roadshow Films v iiNet",
      "court": "Full Court of the Federal Court of Australia",
      "court_code": "FCAFC",
      "jurisdiction": "cth",
      "date": "2002-08-30",
      "source_urls": ["https://example.org/iinet"],
      "source": "open-australian-legal-corpus",
      "source_record_ids": ["fcafc-2002-250"],
      "indexed_at": "2026-05-01",
      "license": "CC-BY-4.0"
    },
    "[2018] FCA 1450": {
      "normalized_citation": "[2018] FCA 1450",
      "citation": "Australian Competition and Consumer Commission v Pirovic Enterprises Pty Ltd [2018] FCA 1450",
      "case_name": "Australian Competition and Consumer Commission v Pirovic Enterprises Pty Ltd",
      "court": "Federal Court of Australia",
      "court_code": "FCA",
      "jurisdiction": "cth",
      "date": "2018-09-26",
      "source_urls": ["https://example.org/pirovic"],
      "source": "open-australian-legal-corpus",
      "source_record_ids": ["fca-2018-1450"],
      "indexed_at": "2026-05-01",
      "license": "CC-BY-4.0"
    },
    "[2020] NSWCA 1": {
      "normalized_citation": "[2020] NSWCA 1",
      "citation": "Smith v Jones [2020] NSWCA 1",
      "case_name": "Smith v Jones",
      "court": "Court of Appeal of New South Wales",
      "court_code": "NSWCA",
      "jurisdiction": "nsw",
      "date": "2020-02-04",
      "source_urls": ["https://example.org/smith"],
      "source": "open-australian-legal-corpus",
      "source_record_ids": ["nswca-2020-1"],
      "indexed_at": "2026-05-01",
      "license": "CC-BY-4.0"
    },
    "[2019] VSCA 50": {
      "normalized_citation": "[2019] VSCA 50",
      "citation": "Doe v Roe [2019] VSCA 50",
      "case_name": "Doe v Roe",
      "court": "Court of Appeal of Victoria",
      "court_code": "VSCA",
      "jurisdiction": "vic",
      "date": "2019-04-12",
      "source_urls": ["https://example.org/doe"],
      "source": "open-australian-legal-corpus",
      "source_record_ids": ["vsca-2019-50"],
      "indexed_at": "2026-05-01",
      "license": "CC-BY-4.0"
    },
    "[2017] QCA 100": {
      "normalized_citation": "[2017] QCA 100",
      "citation": "Brown v Greene [2017] QCA 100",
      "case_name": "Brown v Greene",
      "court": "Court of Appeal of Queensland",
      "court_code": "QCA",
      "jurisdiction": "qld",
      "date": "2017-05-19",
      "source_urls": ["https://example.org/brown"],
      "source": "open-australian-legal-corpus",
      "source_record_ids": ["qca-2017-100"],
      "indexed_at": "2026-05-01",
      "license": "CC-BY-4.0"
    },
    "[2024] NSWSC 9999": [
      {
        "normalized_citation": "[2024] NSWSC 9999",
        "citation": "First Synthetic Case [2024] NSWSC 9999",
        "case_name": "First Synthetic Case",
        "court": "Supreme Court of New South Wales",
        "court_code": "NSWSC",
        "jurisdiction": "nsw",
        "date": "2024-01-01",
        "source_urls": ["https://example.org/first"],
        "source": "open-australian-legal-corpus",
        "source_record_ids": ["nswsc-2024-9999-a"],
        "indexed_at": "2026-05-01",
        "license": "CC-BY-4.0"
      },
      {
        "normalized_citation": "[2024] NSWSC 9999",
        "citation": "Second Synthetic Case [2024] NSWSC 9999",
        "case_name": "Second Synthetic Case",
        "court": "Supreme Court of New South Wales",
        "court_code": "NSWSC",
        "jurisdiction": "nsw",
        "date": "2024-01-15",
        "source_urls": ["https://example.org/second"],
        "source": "open-australian-legal-corpus",
        "source_record_ids": ["nswsc-2024-9999-b"],
        "indexed_at": "2026-05-01",
        "license": "CC-BY-4.0"
      }
    ]
  }
}
